{
  "ok": true,
  "requestId": "req_demo_1",
  "techniqueRequested": ["pageindex", "graph"],
  "techniqueUsed": ["pageindex", "graph_expand"],
  "results": [
    {
      "candidateId": "cand_1",
      "sourceId": "src_policy_v2",
      "ref": "astrospec://sources/src_policy_v2",
      "kind": "document",
      "title": "Records Retention Policy",
      "snippet": "Records must be retained for seven years.",
      "span": { "page": 12, "start": 0, "end": 41 },
      "score": 0.94,
      "rank": 1,
      "stage": "retrieve"
    }
  ],
  "citations": [
    {
      "citationId": "cit_1",
      "candidateId": "cand_1",
      "claimId": "claim_1",
      "label": "Primary policy statement",
      "span": { "page": 12, "start": 0, "end": 41 },
      "quote": "Records must be retained for seven years.",
      "confidence": 0.96
    }
  ],
  "grounding": {
    "supported": true,
    "confidence": 0.96
  },
  "diagnostics": [
    { "stage": "retrieve", "technique": "pageindex", "durationMs": 10, "inputCount": 1, "outputCount": 3 },
    { "stage": "expand", "technique": "graph_expand", "durationMs": 5, "inputCount": 3, "outputCount": 5 }
  ]
}
